District,Member,Party,Born[6],Prior experience,Education,Assumed office,Residence
Rob Wittman,,Republican,"(1959-02-03)February 3, 1959(age 66)",Mayor ofMontrossWestmoreland CountyBoard of SupervisorsVirginia House of Delegates,Virginia Tech(BS)University of North Carolina at Chapel Hill(MPH)Virginia Commonwealth University(PhD),"December 11, 2007(special)",Montross
Jen Kiggans,,Republican,"(1971-06-18)June 18, 1971(age 54)",Virginia SenateU.S. Navy,Old Dominion University(BSN)Vanderbilt University(MSN),"January 3, 2023",Virginia Beach
Bobby Scott,,Democratic,"(1947-04-30)April 30, 1947(age 78)",Virginia SenateVirginia House of Delegates,Harvard University(BA)Boston College(JD),"January 3, 1993",Newport News
Jennifer McClellan,,Democratic,"(1972-12-28)December 28, 1972(age 52)",Virginia SenateVirginia House of Delegates,University of Richmond(BA)University of Virginia(JD),"March 7, 2023(special)",Richmond
John McGuire,,Republican,"(1968-08-24)August 24, 1968(age 57)",Virginia SenateVirginia House of DelegatesU.S. Navy,Okaloosa-Walton Community College,"January 3, 2025",Manakin Sabot
Ben Cline,,Republican,"(1972-02-29)February 29, 1972(age 53)",Virginia House of Delegates,Bates College(BA)University of Richmond(JD),"January 3, 2019",Fincastle
Eugene Vindman,,Democratic,"(1975-06-06)June 6, 1975(age 50)",U.S. ArmyWhite House deputy legal advisor,State University of New York at Binghamton(BA)Central Michigan University(MS)University of Georgia(JD)The Judge Advocate General's Legal Center and School(LLM),"January 3, 2025",Dale City[56]
Don Beyer,,Democratic,"(1950-06-20)June 20, 1950(age 75)",U.S. Ambassador to Switzerland and LiechtensteinLieutenant Governor of Virginia,Williams College(BA)George Mason University,"January 3, 2015",Alexandria
Morgan Griffith,,Republican,"(1958-03-15)March 15, 1958(age 67)",Majority Leader of theVirginia House of Delegates,Emory and Henry College(BA)Washington and Lee University(JD),"January 3, 2011",Salem
Suhas Subramanyam,,Democratic,"(1986-09-26)September 26, 1986(age 38)",Virginia SenateVirginia House of Delegates,Tulane University(BA)Northwestern University(JD),"January 3, 2025",Ashburn
Vacant,,,,,,,
Suzan DelBene,,Democratic,"(1962-02-17)February 17, 1962(age 63)",Washington Department of Revenue Director,Reed College(BS)University of Washington(MBA),"November 13, 2012(special)",Medina
Rick Larsen,,Democratic,"(1965-06-15)June 15, 1965(age 60)",Snohomish CountyCouncil,Pacific Lutheran University(BA)University of Minnesota(MPA),"January 3, 2001",Everett[57]
Marie Gluesenkamp Perez,,Democratic,"(1988-06-06)June 6, 1988(age 37)",Washington State Democratic Partyexecutive committeeUnderwood Soil and Water District Conservation Board of SupervisorsBusinesswoman,Reed College(BA),"January 3, 2023",Washougal[58]
Dan Newhouse,,Republican,"(1955-07-10)July 10, 1955(age 70)",Washington House of Representatives,Washington State University(BS),"January 3, 2015",Sunnyside
Michael Baumgartner,,Republican,"(1975-12-13)December 13, 1975(age 49)",Spokane CountyTreasurerWashington Senate,Washington State University(BA)Harvard University(MPA),"January 3, 2025",Spokane
Emily Randall,,Democratic,"(1985-10-03)October 3, 1985(age 39)",Washington Senate,Wellesley College(BA),"January 3, 2025",Bremerton
Pramila Jayapal,,Democratic,"(1965-09-21)September 21, 1965(age 59)",Washington State Senate,Georgetown University(BA)Northwestern University(MBA),"January 3, 2017",Seattle
Kim Schrier,,Democratic,"(1968-08-23)August 23, 1968(age 57)",Pediatrician,"University of California, Berkeley(BS)University of California, Davis(MD)","January 3, 2019",Sammamish
Adam Smith,,Democratic,"(1965-06-15)June 15, 1965(age 60)",Washington State Senate,Western Washington UniversityFordham University(BA)University of Washington(JD),"January 3, 1997",Bellevue
Marilyn Strickland,,Democratic,"(1962-09-25)September 25, 1962(age 62)",Mayor ofTacoma,University of Washington(BA)Clark Atlanta University(MBA),"January 3, 2021",Tacoma
Carol Miller,,Republican,"(1950-11-04)November 4, 1950(age 74)",West Virginia House of Delegates,"Columbia College, South Carolina(BA)","January 3, 2019",Huntington[59]
Riley Moore,,Republican,"(1980-07-01)July 1, 1980(age 45)",West Virginia State TreasurerWest Virginia House of Delegates,George Mason University(BA)National Defense University(MS),"January 3, 2025",Harpers Ferry
Bryan Steil,,Republican,"(1981-03-03)March 3, 1981(age 44)",Congressional aideAttorney,Georgetown University(BS)University of Wisconsin–Madison(JD),"January 3, 2019",Janesville
Mark Pocan,,Democratic,"(1964-08-14)August 14, 1964(age 61)",Wisconsin State Assembly,University of Wisconsin–Madison(BA),"January 3, 2013",Vermont[60]
Derrick Van Orden,,Republican,"(1969-09-15)September 15, 1969(age 55)",ActorAuthorRestaurateurU.S. Navy,Excelsior College(BS)Mitchell Hamline School of Law,"January 3, 2023",Prairie du Chien
Gwen Moore,,Democratic,"(1951-04-18)April 18, 1951(age 74)",Wisconsin State SenateWisconsin State Assembly,Marquette University(BA),"January 3, 2005",Milwaukee
Scott Fitzgerald,,Republican,"(1963-11-16)November 16, 1963(age 61)",Majority Leader of theWisconsin State Senate,University of Wisconsin–Oshkosh(BS),"January 3, 2021",Clyman[61]
Glenn Grothman,,Republican,"(1955-07-03)July 3, 1955(age 70)",Wisconsin SenateWisconsin State Assembly,"University of Wisconsin–Madison(BA,JD)","January 3, 2015",Glenbeulah[62]
Tom Tiffany,,Republican,"(1957-12-30)December 30, 1957(age 67)",Wisconsin SenateWisconsin State Assembly,University of Wisconsin–River Falls(BS),"May 19, 2020(special)",Minocqua
Tony Wied,,Republican,"(1976-05-03)May 3, 1976(age 49)",Businessman,St. Norbert College(BA),"November 12, 2024(special)",De Pere
Harriet Hageman,,Republican,"(1962-10-18)October 18, 1962(age 62)",LawyerLaw clerk for theU.S. Court of Appeals for the Tenth Circuit,"University of Wyoming(BS,JD)","January 3, 2023",Cheyenne
